{
  "$defs": {
    "vector": {
      "additionalProperties": false,
      "properties": {
        "actionKind": {
          "enum": [
            "DEPOSIT",
            "WITHDRAWAL"
          ]
        },
        "model": {
          "type": "object"
        },
        "vectorId": {
          "type": "string"
        }
      },
      "required": [
        "actionKind",
        "model",
        "vectorId"
      ],
      "type": "object"
    }
  },
  "$id": "shieldkit-labs/poolactionfv1-refreeze-falsifier-vectors/v1",
  "$schema": "https://json-schema.org/draft/2020-12/schema",
  "additionalProperties": false,
  "properties": {
    "classification": {
      "const": "synthetic-offline-non-bch-non-proof"
    },
    "evidenceTier": {
      "const": "INERT_DETERMINISTIC_OFFLINE_REFERENCE_MODEL_ONLY"
    },
    "oracleHashFunction": {
      "const": "sha256-test-only-not-selected"
    },
    "packageId": {
      "const": "evidence:poolactionfv1-refreeze-falsifiers-v1"
    },
    "positives": {
      "items": {
        "$ref": "#/$defs/vector"
      },
      "maxItems": 2,
      "minItems": 2,
      "type": "array"
    },
    "schema": {
      "const": "shieldkit-labs/poolactionfv1-refreeze-falsifier-vectors/v1"
    },
    "spliceAntecedents": {
      "items": {
        "$ref": "#/$defs/vector"
      },
      "maxItems": 1,
      "minItems": 1,
      "type": "array"
    },
    "status": {
      "const": "BLOCKED_VERSION_PIVOT_NO_REFREEZE"
    }
  },
  "required": [
    "classification",
    "evidenceTier",
    "oracleHashFunction",
    "packageId",
    "positives",
    "schema",
    "spliceAntecedents",
    "status"
  ],
  "type": "object"
}
