{
  "classification": "synthetic-offline-non-bch-non-proof",
  "evidenceTier": "INERT_DETERMINISTIC_OFFLINE_REFERENCE_MODEL_ONLY",
  "oracleHashFunction": "sha256-test-only-not-selected",
  "packageId": "evidence:poolactionfv1-refreeze-falsifiers-v1",
  "positives": [
    {
      "actionKind": "DEPOSIT",
      "model": {
        "carrierInputs": [
          {
            "inputIndex": 1,
            "ordinal": 0,
            "sourceLockingBytecodeHex": "6a201111111111111111111111111111111111111111111111111111111111111111201a1dced5d86cb0367ff9200b1b6bfbf735b66270e3b5288239180afa1b6dc5110200000140",
            "successorLockingBytecodeHex": "6a201111111111111111111111111111111111111111111111111111111111111111201a1dced5d86cb0367ff9200b1b6bfbf735b66270e3b5288239180afa1b6dc5110200000140",
            "wrapperHex": "50414748010003004d02504153540100010100111111111111111111111111111111111111111111111111111111111111111122222222222222222222222222222222222222222222222222222222222222221a1dced5d86cb0367ff9200b1b6bfbf735b66270e3b5288239180afa1b6dc511555555555555555555555555555555555555555555555555555555555555555500000000e80300000000000050414631010000000000000000000000000000000000000000000000000000001111111111111111111111111111111111111111111111111111111111111111aaaaaaaaaaaaaaaaaaaaaaaaaaaaaaaaaaaaaaaaaaaaaaaaaaaaaaaaaaaaaaaabbbbbbbbbbbbbbbbbbbbbbbbbbbbbbbbbbbbbbbbbbbbbbbbbbbbbbbbbbbbbbbb0000689a98000000000050414631010000000100000000000000010000000000000000000000000000001111111111111111111111111111111111111111111111111111111111111111ccccccccccccccccccccccccccccccccccccccccccccccccccccccccccccccccbbbbbbbbbbbbbbbbbbbbbbbbbbbbbbbbbbbbbbbbbbbbbbbbbbbbbbbbbbbbbbbb8096980000000000809698000000000077777777777777777777777777777777777777777777777777777777777777770000000000000000000000000000000000000000000000000000000000000000ffff000000000000000000000000000000000000000000000000000000000000000000000000000000000400fffff40100000000000010270000000000009d1c7da4dbb51e11457b9e9e3a5e7abd34c31202233feffcdb32f9ff133842367a84f1a8a54fce0d9114663ab2ebe3706232544bf2b6ae6c96b488f675cdb2d406a90dc135c26400eb6f5a4d1d946d163d2819fd454cccd6f9eced7a96d41a710300600024518ae358970c6f5a6f1442c61c9d23769b53edab8e5148e95bf1f437998d6de50dac469fd29e1264ae494494732e30e224131332ded1ae8982bdf8c3966049de5321443d730f38fabc591ab1a668a9165b5ec2d07282ffe15f5cc8f8a72f930000230073796e7468657469632d6f66666c696e652d6465706f7369742d73656374696f6e2d30"
          },
          {
            "inputIndex": 2,
            "ordinal": 1,
            "sourceLockingBytecodeHex": "6a201111111111111111111111111111111111111111111111111111111111111111201a1dced5d86cb0367ff9200b1b6bfbf735b66270e3b5288239180afa1b6dc51102010001ab",
            "successorLockingBytecodeHex": "6a201111111111111111111111111111111111111111111111111111111111111111201a1dced5d86cb0367ff9200b1b6bfbf735b66270e3b5288239180afa1b6dc51102010001ab",
            "wrapperHex": "504153430100030001007a84f1a8a54fce0d9114663ab2ebe3706232544bf2b6ae6c96b488f675cdb2d406a90dc135c26400eb6f5a4d1d946d163d2819fd454cccd6f9eced7a96d41a71230073796e7468657469632d6f66666c696e652d6465706f7369742d73656374696f6e2d31"
          },
          {
            "inputIndex": 3,
            "ordinal": 2,
            "sourceLockingBytecodeHex": "6a201111111111111111111111111111111111111111111111111111111111111111201a1dced5d86cb0367ff9200b1b6bfbf735b66270e3b5288239180afa1b6dc5110202000142",
            "successorLockingBytecodeHex": "6a201111111111111111111111111111111111111111111111111111111111111111201a1dced5d86cb0367ff9200b1b6bfbf735b66270e3b5288239180afa1b6dc5110202000142",
            "wrapperHex": "504153430100030002007a84f1a8a54fce0d9114663ab2ebe3706232544bf2b6ae6c96b488f675cdb2d406a90dc135c26400eb6f5a4d1d946d163d2819fd454cccd6f9eced7a96d41a71230073796e7468657469632d6f66666c696e652d6465706f7369742d73656374696f6e2d32"
          }
        ],
        "deployment": {
          "carrierCount": 3,
          "carrierManifestDigestHex": "1a1dced5d86cb0367ff9200b1b6bfbf735b66270e3b5288239180afa1b6dc511",
          "concreteCarrierLockingBytecodeHex": [
            "6a201111111111111111111111111111111111111111111111111111111111111111201a1dced5d86cb0367ff9200b1b6bfbf735b66270e3b5288239180afa1b6dc5110200000140",
            "6a201111111111111111111111111111111111111111111111111111111111111111201a1dced5d86cb0367ff9200b1b6bfbf735b66270e3b5288239180afa1b6dc51102010001ab",
            "6a201111111111111111111111111111111111111111111111111111111111111111201a1dced5d86cb0367ff9200b1b6bfbf735b66270e3b5288239180afa1b6dc5110202000142"
          ],
          "networkId": "chipnet",
          "networkTag": 1,
          "poolInstanceIdHex": "1111111111111111111111111111111111111111111111111111111111111111",
          "proofSecurityProfileDigestHex": "2222222222222222222222222222222222222222222222222222222222222222",
          "protocolTemplateDigestHex": "7dc697abad4e1daa1513fb88d288b90c2a374a14387e7a462b2f95f81d6de163",
          "templateDefinition": {
            "placeholderSchema": [
              {
                "bytes": 32,
                "name": "poolInstanceId",
                "type": "bytes32"
              },
              {
                "bytes": 32,
                "name": "carrierManifestDigest",
                "type": "bytes32"
              },
              {
                "bytes": 2,
                "name": "ordinal",
                "type": "u16le"
              },
              {
                "bytes": 1,
                "name": "policyByte",
                "type": "u8"
              }
            ],
            "templateId": "offline:carrier-lock-template-fv1",
            "templateRawAscii": "OP_RETURN PUSH32(poolInstanceId) PUSH32(carrierManifestDigest) PUSH2(ordinalLE) PUSH1(policyByte)"
          },
          "templateParameters": [
            {
              "ordinal": 0,
              "policyByte": 64
            },
            {
              "ordinal": 1,
              "policyByte": 171
            },
            {
              "ordinal": 2,
              "policyByte": 66
            }
          ],
          "tokenKinds": [
            "none",
            "none",
            "none"
          ]
        },
        "digestAuthority": {
          "injectedDigestHex": null,
          "source": "recomputed-complete-introspection-only"
        },
        "modelVersion": 1,
        "pastHex": "504153540100010100111111111111111111111111111111111111111111111111111111111111111122222222222222222222222222222222222222222222222222222222222222221a1dced5d86cb0367ff9200b1b6bfbf735b66270e3b5288239180afa1b6dc511555555555555555555555555555555555555555555555555555555555555555500000000e80300000000000050414631010000000000000000000000000000000000000000000000000000001111111111111111111111111111111111111111111111111111111111111111aaaaaaaaaaaaaaaaaaaaaaaaaaaaaaaaaaaaaaaaaaaaaaaaaaaaaaaaaaaaaaaabbbbbbbbbbbbbbbbbbbbbbbbbbbbbbbbbbbbbbbbbbbbbbbbbbbbbbbbbbbbbbbb0000689a98000000000050414631010000000100000000000000010000000000000000000000000000001111111111111111111111111111111111111111111111111111111111111111ccccccccccccccccccccccccccccccccccccccccccccccccccccccccccccccccbbbbbbbbbbbbbbbbbbbbbbbbbbbbbbbbbbbbbbbbbbbbbbbbbbbbbbbbbbbbbbbb8096980000000000809698000000000077777777777777777777777777777777777777777777777777777777777777770000000000000000000000000000000000000000000000000000000000000000ffff000000000000000000000000000000000000000000000000000000000000000000000000000000000400fffff40100000000000010270000000000009d1c7da4dbb51e11457b9e9e3a5e7abd34c31202233feffcdb32f9ff13384236",
        "runtimeNetworkId": "chipnet",
        "tokenBridge": [
          {
            "candidateCanonicalKinds": [
              "none"
            ],
            "introspectionProjection": {
              "amount": "0",
              "categoryHex": "",
              "commitmentHex": "",
              "hasToken": false
            },
            "manifestKind": "none",
            "ordinal": 0
          },
          {
            "candidateCanonicalKinds": [
              "none"
            ],
            "introspectionProjection": {
              "amount": "0",
              "categoryHex": "",
              "commitmentHex": "",
              "hasToken": false
            },
            "manifestKind": "none",
            "ordinal": 1
          },
          {
            "candidateCanonicalKinds": [
              "none"
            ],
            "introspectionProjection": {
              "amount": "0",
              "categoryHex": "",
              "commitmentHex": "",
              "hasToken": false
            },
            "manifestKind": "none",
            "ordinal": 2
          }
        ],
        "transactionContext": {
          "actionKind": "DEPOSIT",
          "carrierManifestDigestHex": "1a1dced5d86cb0367ff9200b1b6bfbf735b66270e3b5288239180afa1b6dc511",
          "codecVersion": 1,
          "inputs": [
            {
              "index": 0,
              "outpointIndex": 0,
              "outpointTxidWireHex": "5555555555555555555555555555555555555555555555555555555555555555",
              "role": "STATE",
              "roleOrdinal": 0,
              "sequence": 4294967295,
              "sourceLockingBytecodeHex": "51",
              "sourceToken": {
                "amount": "0",
                "capability": "mutable",
                "categoryHex": "4444444444444444444444444444444444444444444444444444444444444444",
                "commitmentHex": "50414631010000000000000000000000000000000000000000000000000000001111111111111111111111111111111111111111111111111111111111111111aaaaaaaaaaaaaaaaaaaaaaaaaaaaaaaaaaaaaaaaaaaaaaaaaaaaaaaaaaaaaaaabbbbbbbbbbbbbbbbbbbbbbbbbbbbbbbbbbbbbbbbbbbbbbbbbbbbbbbbbbbbbbbb"
              },
              "sourceValueSats": "1000"
            },
            {
              "index": 1,
              "outpointIndex": 1,
              "outpointTxidWireHex": "5555555555555555555555555555555555555555555555555555555555555555",